{
  "$schema": "http://json-schema.org/draft-07/schema#",
  "title": "Application Configuration",
  "description": "Schema for application configuration validation",
  "type": "object",
  "required": ["app", "database", "api"],
  "properties": {
    "app": {
      "type": "object",
      "required": ["name", "version"],
      "properties": {
        "name": {
          "type": "string",
          "minLength": 1,
          "maxLength": 100
        },
        "version": {
          "type": "string",
          "pattern": "^\\d+\\.\\d+\\.\\d+$"
        },
        "debug": {
          "type": "boolean"
        }
      }
    },
    "database": {
      "type": "object",
      "required": ["host", "port", "name"],
      "properties": {
        "host": {
          "type": "string",
          "minLength": 1
        },
        "port": {
          "type": "integer",
          "minimum": 1,
          "maximum": 65535
        },
        "name": {
          "type": "string",
          "minLength": 1
        },
        "username": {
          "type": "string"
        },
        "password": {
          "type": "string"
        }
      }
    },
    "redis": {
      "type": "object",
      "properties": {
        "host": {
          "type": "string"
        },
        "port": {
          "type": "integer",
          "minimum": 1,
          "maximum": 65535
        },
        "password": {
          "type": "string"
        }
      }
    },
    "api": {
      "type": "object",
      "required": ["base_url"],
      "properties": {
        "base_url": {
          "type": "string",
          "format": "uri"
        },
        "timeout": {
          "type": "integer",
          "minimum": 1,
          "maximum": 300
        },
        "retry_count": {
          "type": "integer",
          "minimum": 0,
          "maximum": 10
        }
      }
    },
    "logging": {
      "type": "object",
      "properties": {
        "level": {
          "type": "string",
          "enum": ["DEBUG", "INFO", "WARNING", "ERROR", "CRITICAL"]
        },
        "format": {
          "type": "string"
        },
        "file": {
          "type": "string"
        }
      }
    },
    "features": {
      "type": "object",
      "properties": {
        "cache_enabled": {
          "type": "boolean"
        },
        "rate_limit": {
          "type": "integer",
          "minimum": 0
        },
        "maintenance_mode": {
          "type": "boolean"
        }
      }
    }
  }
}
